{
  "request_id": "req-0001",
  "created_at": "2026-01-28T00:00:00Z",
  "run_id": "run-123",
  "graph_id": "graph-0001",
  "node_id": "T0000",
  "wih_id": "T0000",
  "agent_profile_id": "kernel-default",
  "write_scope": {
    "root": "/.a2r/",
    "allowed_globs": [
      "/.a2r/artifacts/run-123/**",
      "/.a2r/receipts/run-123/**"
    ]
  },
  "mode": "execute"
}
